[
  {
    "id": "cardiac-arrhythmia",
    "name": "Cardiac Arrhythmia",
    "primary_domain": "B",
    "level": "DP",
    "description": "Irregular cardiac rhythm arising from conduction disruption.",
    "coordinates": {
      "REC_count": 3,
      "SRO": 30,
      "TMP": 95,
      "CPL": 70,
      "GEN": 85,
      "CAU": 20,
      "NRG": 60,
      "DET": 40,
      "REV": 20
    },
    "anchors": ["TMP≈95: beat-to-beat time dependence"],
    "mechanism": "Destabilized conduction loops disrupt rhythm.",
    "translation_notes": "Maps to resonance catastrophe in engineering.",
    "sources": [],
    "confidence": 0.7,
    "assessor": "epistria",
    "version": "0.1.0",
    "last_updated": "2025-09-28"
  },
  {
    "id": "financial-contagion",
    "name": "Financial Contagion",
    "primary_domain": "S",
    "level": "DP",
    "description": "Propagation of financial shocks through interconnected markets.",
    "coordinates": {
      "REC_count": 5,
      "SRO": 25,
      "TMP": 90,
      "CPL": 80,
      "GEN": 75,
      "CAU": 40,
      "NRG": 55,
      "DET": 35,
      "REV": 30
    },
    "anchors": ["TMP≈90: rapid transmission speed"],
    "mechanism": "Liquidity shocks amplify via coupled institutions.",
    "translation_notes": "Maps to arrhythmia cascades in biology.",
    "sources": [],
    "confidence": 0.6,
    "assessor": "epistria",
    "version": "0.1.0",
    "last_updated": "2025-09-28"
  }
]

