{
  "id": "cardiac-arrhythmia",
  "name": "Cardiac Arrhythmia",
  "primary_domain": "B",
  "level": "DP",
  "description": "Disruption of cardiac electrical conduction producing irregular rhythm; recognition can occur within a few beats; timing critical and reversal becomes harder as cascades propagate.",
  "coordinates": {
    "REC_count": 3,
    "SRO": 30,
    "TMP": 95,
    "CPL": 70,
    "GEN": 85,
    "CAU": 20,
    "NRG": 60,
    "DET": 40,
    "REV": 20
  },
  "anchors": [
    "TMP≈95: beat-to-beat time dependence",
    "SRO≈30: fragile near threshold",
    "GEN≈85: high cascade potential"
  ],
  "mechanism": "Mis-timed excitation and conduction loops destabilize rhythm; intervention restores coherent phase.",
  "translation_notes": "Maps to resonance catastrophe in engineering (introduce damping/counter-rhythm).",
  "sources": [],
  "confidence": 0.7,
  "assessor": "epistria",
  "version": "0.1.0",
  "last_updated": "2025-09-28",
  "constraint_flags": [],
  "impossibility_index": 0,
  "notation_primary": "DP_REC3.SRO30.TMP95",
  "notation_full": "[DP|REC:3|SRO:30|TMP:95|CPL:70|GEN:85|CAU:20|NRG:60|DET:40|REV:20]"
}
